{
  "id": "EXP-B-004-003-001",
  "questionId": "B-004-003-001",
  "bankId": "basic-2025-07-15",
  "status": "draft",
  "body": {
    "en": "Question B-004-003-001.\n\nWhy the correct answer is right: A bipolar transistor can amplify small signals in low-voltage semiconductor circuits.\n\nWhy the distractors are wrong:\n- sourceIndex 1: \"Variable resistor\": A variable resistor changes resistance but does not provide active signal gain by itself.\n- sourceIndex 2: \"Thyristor\": A thyristor is mainly a controlled switching device, not the basic small-signal amplifier named here.\n- sourceIndex 3: \"Silicon-controlled rectifier\": A silicon-controlled rectifier is a thyristor used for controlled rectification or switching, not ordinary low-voltage amplification.",
    "fr": null
  },
  "citations": [
    {
      "type": "lesson",
      "id": "L-004-02"
    },
    {
      "type": "question",
      "id": "B-004-003-001"
    }
  ],
  "licenseClass": "original"
}
