{
  "id": "EXP-B-003-021-003",
  "questionId": "B-003-021-003",
  "bankId": "basic-2025-07-15",
  "status": "draft",
  "body": {
    "en": "Question B-003-021-003.\n\nWhy the correct answer is right: Before shielding is removed, the amplifier must be unable to turn on accidentally, preventing exposed radio-frequency (RF) energy and high voltage from becoming live.\n\nWhy the distractors are wrong:\n- sourceIndex 1: \"Make sure that RF leakage filters are connected\": Filters do not make an open amplifier safe if it can energize high-voltage or RF circuits while shielding is removed.\n- sourceIndex 2: \"Make sure the amplifier output connector is grounded\": Grounding an output connector does not lock out the internal power supply or prevent accidental energizing.\n- sourceIndex 3: \"Make sure all RF screens are in place at the amplifier output connector\": The hazard is created by removing shielding. Checking a screen at one connector does not make the exposed amplifier safe to energize.",
    "fr": null
  },
  "citations": [
    {
      "type": "lesson",
      "id": "L-003-08"
    },
    {
      "type": "question",
      "id": "B-003-021-003"
    }
  ],
  "licenseClass": "original"
}
