{
  "id": "EXP-B-003-011-001",
  "questionId": "B-003-011-001",
  "bankId": "basic-2025-07-15",
  "status": "draft",
  "body": {
    "en": "Question B-003-011-001.\n\nWhy the correct answer is right: Chirp is a brief change in transmitter output frequency as each CW element is keyed, so the received pitch seems to slide at the start or end of dits and dahs.\n\nWhy the distractors are wrong:\n- sourceIndex 1: \"A high-pitched tone which is received along with every CW dit and dah\": A separate high audio tone would be an added tone or receiver audio issue, not movement of the RF carrier frequency during keying.\n- sourceIndex 2: \"A slow change in transmitter frequency as the oscillator warms up\": Warm-up drift is a gradual frequency change over seconds or minutes. Chirp is tied to each keyed element.\n- sourceIndex 3: \"An overload in a receiver's audio circuit whenever CW is received\": Receiver audio overload is a receiving-station problem and would not describe a transmitter frequency shift.",
    "fr": null
  },
  "citations": [
    {
      "type": "lesson",
      "id": "L-003-05"
    },
    {
      "type": "question",
      "id": "B-003-011-001"
    }
  ],
  "licenseClass": "original"
}
