{
  "id": "EXP-B-006-012-006",
  "questionId": "B-006-012-006",
  "bankId": "basic-2025-07-15",
  "status": "draft",
  "body": {
    "en": "Question B-006-012-006.\n\nWhy the correct answer is right: An end-fed half-wave (EFHW) antenna can be used on multiple bands. The same wire can operate on harmonic half-wave resonances when it is matched properly.\n\nWhy the distractors are wrong:\n- sourceIndex 1: \"Matching network not needed to feed with coaxial cable\": An EFHW has a high end impedance and normally needs a transformer or matching network to feed it from low-impedance coax.\n- sourceIndex 2: \"High resistance to local noise pickup\": End-fed wires can still pick up local noise, especially through common-mode current on the feedline. Noise immunity is not their major advantage.\n- sourceIndex 3: \"Develops minimal common-mode current\": An EFHW often needs a counterpoise and choking because common-mode current can occur on the outside of the coax. Minimal common-mode current is not guaranteed.",
    "fr": null
  },
  "citations": [
    {
      "type": "lesson",
      "id": "L-006-05"
    },
    {
      "type": "question",
      "id": "B-006-012-006"
    }
  ],
  "licenseClass": "original"
}
