{
  "id": "EXP-B-003-012-011",
  "questionId": "B-003-012-011",
  "bankId": "basic-2025-07-15",
  "status": "draft",
  "body": {
    "en": "Question B-003-012-011.\n\nWhy the correct answer is right: ALC reduces excessive audio or drive peaks so the SSB transmitter is not pushed into splatter-producing overdrive.\n\nPer-choice notes:\n- sourceIndex 0: \"limits the input audio peaks so that the transmitter is not overdriven\": This is the correct choice because ALC reduces excessive audio or drive peaks so the SSB transmitter is not pushed into splatter-producing overdrive.\n- sourceIndex 1: \"reduces transmitter audio feedback\": This is a near-miss because it shifts attention from limits the input audio peaks so that the transmitter is not overdriven. In SSB microphone level, carrier suppression, sideband frequency, and peak envelope power, it names a different cause, control, component, or safety action than the one required here.\n- sourceIndex 2: \"increases the occupied bandwidth\": This answer would fit a different fault than limits the input audio peaks so that the transmitter is not overdriven. In SSB microphone level, carrier suppression, sideband frequency, and peak envelope power, more of that quantity would not address the fault and can make a clean-signal problem worse.\n- sourceIndex 3: \"reduces system noise\": This option confuses another station topic with limits the input audio peaks so that the transmitter is not overdriven. In SSB microphone level, carrier suppression, sideband frequency, and peak envelope power, noise control may be useful elsewhere, but this choice points to the wrong block or symptom.",
    "fr": null
  },
  "citations": [
    {
      "type": "lesson",
      "id": "L-003-05"
    },
    {
      "type": "question",
      "id": "B-003-012-011"
    }
  ],
  "licenseClass": "original"
}
